{
  "standard": {
    "id": "agreements",
    "coreVersion": "1.1.0-draft",
    "profiles": [
      {
        "id": "evm",
        "version": "1.0.0-draft"
      }
    ]
  },
  "metadata": {
    "id": "did:example:123456789abcdefghi",
    "templateId": "did:template:grant-agreement-v1",
    "version": "1.0.0",
    "createdAt": "2024-03-20T12:00:00Z",
    "name": "Grant Agreement",
    "author": "Ecosystem Name Foundation",
    "description": "Standard grant agreement for ecosystem development funding"
  },
  "variables": [
    {
      "id": "effectiveDate",
      "type": "dateTime",
      "name": "Effective Date",
      "description": "The date when this agreement becomes effective",
      "value": "",
      "validation": {
        "required": true,
        "message": "Effective date is required"
      }
    },
    {
      "id": "foundationName",
      "type": "string",
      "name": "Foundation Name",
      "description": "Legal name of the foundation entity",
      "value": "Ecosystem Name Foundation",
      "validation": {
        "required": true,
        "minLength": 3,
        "message": "Foundation name is required"
      }
    },
    {
      "id": "jurisdiction",
      "type": "string",
      "name": "Jurisdiction",
      "description": "Legal jurisdiction under which the foundation operates",
      "value": "Jurisdiction",
      "validation": {
        "required": true,
        "message": "Jurisdiction is required"
      }
    },
    {
      "id": "foundationAddress",
      "type": "string",
      "semanticType": "evm/address",
      "name": "Foundation Address",
      "description": "Blockchain address of the foundation",
      "value": "0x123f6e75d1BE0ee699C7Eb67594FEbC14ab3AA78",
      "validation": {
        "required": true,
        "pattern": "^0x[a-fA-F0-9]{40}$",
        "message": "Invalid D3 address format"
      }
    },
    {
      "id": "grantRecipientName",
      "type": "string",
      "name": "Grant Recipient Name",
      "description": "Full name of the grant recipient",
      "value": "",
      "validation": {
        "required": true,
        "minLength": 2,
        "message": "Grant recipient name is required"
      }
    },
    {
      "id": "grantRecipientAddress",
      "type": "string",
      "semanticType": "evm/address",
      "name": "Grant Recipient Address",
      "description": "Blockchain address of the grant recipient",
      "value": null,
      "validation": {
        "required": true,
        "pattern": "^0x[a-fA-F0-9]{40}$",
        "message": "Invalid D3 address format"
      }
    },
    {
      "id": "ecosystemName",
      "type": "string",
      "name": "Ecosystem Name",
      "description": "Name of the blockchain ecosystem",
      "value": "Ecosystem Name",
      "validation": {
        "required": true,
        "message": "Ecosystem name is required"
      }
    },
    {
      "id": "workTokenName",
      "type": "string",
      "name": "Work Token Name",
      "description": "Name of the ecosystem's native token",
      "value": "WORK",
      "validation": {
        "required": true,
        "message": "Token name is required"
      }
    },
    {
      "id": "tokenAllocatorName",
      "type": "string",
      "name": "Token Allocator Name",
      "description": "Name of the person designated to allocate tokens",
      "value": "",
      "validation": {
        "required": true,
        "message": "Token allocator name is required"
      }
    },
    {
      "id": "tokenAllocatorAddress",
      "type": "string",
      "semanticType": "evm/address",
      "name": "Token Allocator Address",
      "description": "Blockchain address of the token allocator",
      "value": null,
      "validation": {
        "required": true,
        "pattern": "^0x[a-fA-F0-9]{40}$",
        "message": "Invalid D3 address format"
      }
    },
    {
      "id": "rfpNumber",
      "type": "string",
      "name": "RFP Number",
      "description": "Reference number for the Request for Proposal",
      "value": "",
      "validation": {
        "required": true,
        "pattern": "^WRFP-[0-9]+$",
        "message": "RFP number must be in format WRFP-XXX"
      }
    },
    {
      "id": "rfpLink",
      "type": "string",
      "name": "RFP Link",
      "description": "URL link to the Request for Proposal document",
      "value": "",
      "validation": {
        "required": true,
        "pattern": "^https?:\\/\\/.*",
        "message": "Must be a valid URL"
      }
    },
    {
      "id": "grantAmount",
      "type": "number",
      "name": "Grant Amount",
      "description": "Amount of tokens to be granted to the recipient",
      "value": 0,
      "validation": {
        "required": true,
        "min": 1,
        "message": "Grant amount must be greater than zero"
      }
    }
  ],
  "content": {
    "type": "md",
    "data": "# **Grant Agreement**\n\nThis Grant Agreement (**\"Agreement\"**) is entered into on :variable{id=\"effectiveDate\"}, (the **:variable{id=\"effectiveDate\" property=\"name\"}**), between :variable{id=\"foundationName\"}, a :variable{id=\"jurisdiction\"} foundation company (the **:variable{id=\"foundationName\" property=\"name\"}**) with D3 address :variable{id=\"foundationAddress\"}, and :variable{id=\"grantRecipientName\"}, an individual with address :variable{id=\"grantRecipientAddress\"} (**:variable{id=\"grantRecipientName\" property=\"name\"}**).\n\nThe Foundation has been established, in part, to help promote growth of the :variable{id=\"ecosystemName\"} ecosystem and seeks to award grants to promote development consistent with the collective decision making of the :variable{id=\"workTokenName\"} token (**:variable{id=\"workTokenName\"}**) holder community (the **:variable{id=\"workTokenName\"} Community**).\n\nThe Grant Recipient has been selected by the Foundation Designated Token Allocator :variable{id=\"tokenAllocatorName\"} (**:variable{id=\"tokenAllocatorName\" property=\"name\"}**) with address :variable{id=\"tokenAllocatorAddress\"} to receive a grant subject and in accordance with the terms and conditions of this Agreement.\n\nTHEREFORE, the parties agree as follows:\n\n## **1. GRANT RECIPIENT ACTIVITIES**\n\n1.1 Grants. Foundation and Grant Recipient are entering into this Agreement in connection with RFP#: :variable{id=\"rfpNumber\"}, as set forth at :variable{id=\"rfpLink\"}, which describes the specific activities to be performed by Grant Recipient (the **\"Grant\"**).\n\n1.2 Performance of Grant Recipient Activities. Grant Recipient will perform the activities described in the Grant (the **\"Grant Recipient Activities\"**) in accordance with the terms and conditions set forth in each such Grant and this Agreement and with any applicable laws.\n\n## **2. GRANT DISTRIBUTION**\n\nThe Token Allocator will pay Grant Recipient on behalf of the Foundation the amount of :variable{id=\"grantAmount\"} :variable{id=\"workTokenName\"} tokens in accordance with the terms set forth in this agreement.\n\nIN WITNESS WHEREOF, the Grant Recipient has executed this Agreement on the date first written above.\n\nName: :variable{id=\"grantRecipientName\"}"
  }
}
